paper_id,pmid,title,abstract,journal,publication_date,authors,authors_str,num_authors,doi,mesh_terms,has_abstract,abstract_length,specialty,collection_date
38161075,38161075,Best practice & research clinical endocrinology & metabolism focusing on the menopause - Diagnostic and therapeutic strategies.,,Best practice & research. Clinical endocrinology & metabolism,2024-Jan,['Barber KA'],Barber KA,1,10.1016/j.beem.2023.101856,"['Female', 'Humans', 'Menopause', 'Endocrinology']",False,0,endocrinology,2026-04-22
38466742,38466742,Artificial Intelligence in Endocrinology: On Track Toward Great Opportunities.,"In endocrinology, the types and quantity of digital data are increasing rapidly. Computing capabilities are also developing at an incredible rate, as illustrated by the recent expansion in the use of popular generative artificial intelligence (AI) applications. Numerous diagnostic and therapeutic devices using AI have already entered routine endocrine practice, and developments in this field are expected to continue to accelerate. Endocrinologists will need to be supported in managing AI applications. Beyond technological training, interdisciplinary vision is needed to encompass the ethical and legal aspects of AI, to manage the profound impact of AI on patient/provider relationships, and to maintain an optimal balance between human input and AI in endocrinology.",The Journal of clinical endocrinology and metabolism,2024-May-17,"['Assié G', 'Allassonnière S']","Assié G, Allassonnière S",2,10.1210/clinem/dgae154,"['Humans', 'Artificial Intelligence', 'Endocrinology']",True,773,endocrinology,2026-04-22
37166328,37166328,Key Stages in the Development and Establishment of Paediatric Endocrinology: A Template for Future Progress.,"Paediatric endocrinology became recognised in Western European countries in the 1960s and 1970s. It is now a thriving paediatric sub-speciality in many countries but remains non-existent or in its infancy in others. We have had the privilege to work in Western centres of excellence, and this review outlines the key stages in the development of modern centres, discussing the human and organisational issues that have underpinned progress in the establishment of this paediatric sub-speciality. Human determination, vision, and ambition to create a modern centre and become a national flag bearer in the field are key components of success. The realisation that learning by spending time as a fellow away from one's home institution, so that knowledge can be acquired and brought back home, is also a key factor. Career structures should be designed to mentor and guide the trainee returning from a fellowship abroad. Scientific societies such as the European Society for Paediatric Endocrinology (ESPE) are key resources for networking, support, and discussion with experienced colleagues who may have faced similar challenges. Training and acquisition of knowledge through on-site or e-learning initiatives are beneficial and numerous examples exist, including the telemedicine model of store-and-forward consultations. Leadership skills can be learnt, and good working relationships with adult endocrinology colleagues result in benefits and political support. The development of paediatric endocrinology in a region with hitherto no such facilities constitutes a major contribution to local, regional, and, in all likelihood, national patient care.",Hormone research in paediatrics,2024,"['Savage MO', 'Donaldson MDC', 'Davies JH', 'Storr HL']","Savage MO, Donaldson MDC, Davies JH, Storr HL",4,10.1159/000530841,"['Child', 'Humans', 'Endocrinology', 'Pediatrics', 'Specialization']",True,1653,endocrinology,2026-04-22
36357198,36357198,"Is the ""E"" being removed from Reproductive Endocrinology to be replaced by a ""G"" for Genetics?",,Fertility and sterility,2022-Dec,"['DeCherney AH', 'Brolinson M', 'Whiteley G', 'Legro RS', 'Santoro N']","DeCherney AH, Brolinson M, Whiteley G, Legro RS, Santoro N",5,10.1016/j.fertnstert.2022.10.011,"['Humans', 'Reproductive Medicine', 'Endocrinology']",False,0,endocrinology,2026-04-22
36528489,36528489,Perception of training and job perspectives among final-year residents in the specialty of Endocrinology and Nutrition.,"The medical specialisation model in Spain is carried out in the context of specialised health training, through the residency programme. The aim of the study is to analyse, by an anonymous survey, the opinion on three aspects among final-year residents in Endocrinology and Nutrition (E&N): self-assessment of the knowledge acquired, working prospects, care and training consequences arising from the pandemic COVID-19. Cross-sectional observational study using a voluntary and anonymous online survey, shared among final-year national interns in the last year of the E&N programme, carried out between June-July 2021. 51 responses were obtained, 66% of the fourth-year residents. Overall perception of their knowledge was 7.8 out of 10. Most external rotations were in thyroid and nutrition areas. A total of 96.1% residents, carried out some activity associated with COVID-19, with a training deterioration of 6.9 out of 10. 88.2% cancelled their rotations and 74.5% extended their working schedule. The average negative emotional impact was 7.3 out of 10. 80.4% would like to continue in their training hospital, remaining 45.1%. 56.7% have an employment contract of less than 6 months, most of them practising Endocrinology. The perception of the knowledge acquired during the training period is a ""B"". Residents consider that the pandemic has led to a worsening of their training, generating a negative emotional impact. Employment outlook after completing the residency can be summarised as: temporality, practice of Endocrinology and interhospital mobility.","Endocrinologia, diabetes y nutricion",2023-Jun,"['de Carlos Artajo J', 'Zabalza San Martin L', 'Alcántara Laguna MD', 'Gallego Gamero F', 'Serés-Noriega T', 'Zugasti Murillo A', 'Ballesteros-Pomar MD']","de Carlos Artajo J, Zabalza San Martin L, Alcántara Laguna MD, Gallego Gamero F, Serés-Noriega T, Zugasti Murillo A, Ballesteros-Pomar MD",7,10.1016/j.endien.2022.02.025,"['Humans', 'Cross-Sectional Studies', 'COVID-19', 'Medicine', 'Endocrinology', 'Perception']",True,1564,endocrinology,2026-04-22
37670875,37670875,Editorial: Cross-talk and interaction between endocrinology and urology: challenges and opportunities.,,Frontiers in endocrinology,2023,"['Song Y', 'Du C', 'Liu X']","Song Y, Du C, Liu X",3,10.3389/fendo.2023.1269484,"['Urology', 'Endocrinology', 'Cell Physiological Phenomena']",False,0,endocrinology,2026-04-22
37328313,37328313,Endocrinology and big data.,,"Endocrinologia, diabetes y nutricion",2023,"['Díez JJ', 'Benavent M']","Díez JJ, Benavent M",2,10.1016/j.endien.2023.06.002,"['Big Data', 'Endocrinology']",False,0,endocrinology,2026-04-22
34876198,34876198,"Developments in pediatrics in 2020: choices in allergy, autoinflammatory disorders, critical care, endocrinology, genetics, infectious diseases, microbiota, neonatology, neurology, nutrition, ortopedics, respiratory tract illnesses and rheumatology.","In this article, we describe the advances in the field of pediatrics that have been published in the Italian Journal of Pediatrics in 2020. We report progresses in understanding allergy, autoinflammatory disorders, critical care, endocrinology, genetics, infectious diseases, microbiota, neonatology, neurology, nutrition, orthopedics, respiratory tract illnesses, rheumatology in childhood.",Italian journal of pediatrics,2021-Dec-07,"['Caffarelli C', 'Santamaria F', 'Procaccianti M', 'Piro E', 'Delle Cave V', 'Borrelli M', 'Santoro A', 'Grassi F', 'Bernasconi S', 'Corsello G']","Caffarelli C, Santamaria F, Procaccianti M, Piro E, Delle Cave V, Borrelli M, Santoro A, Grassi F, Bernasconi S, Corsello G",10,10.1186/s13052-021-01184-4,"['COVID-19', 'Child Nutrition Sciences', 'Critical Care', 'Endocrinology', 'Gastrointestinal Microbiome', 'Humans', 'Hypersensitivity', 'Infectious Disease Medicine', 'Neonatology', 'Neurology', 'Orthopedics', 'Pediatrics', 'Rare Diseases', 'Respiratory Tract Diseases', 'Rheumatology']",True,391,endocrinology,2026-04-22
37094561,37094561,A Critical Review of Upcoming New Therapeutic Options in Paediatric Endocrinology.,,Hormone research in paediatrics,2024,"['Cianfarani S', 'Battelino T']","Cianfarani S, Battelino T",2,10.1159/000530824,"['Humans', 'Endocrinology', 'Child', 'Endocrine System Diseases', 'Female', 'Pediatrics', 'Male', 'Adolescent', 'Child, Preschool']",False,0,endocrinology,2026-04-22
32564240,32564240,Gender inequality in leadership and academic rank in academic reproductive endocrinology programs.,"To identify gender differences in leadership and academic rank within academic reproductive endocrinology (REI) programs with fellowships in the USA. Official institutional websites of the 2017-2018 American Board of Obstetrics and Gynecology (ABOG)-accredited reproductive endocrinology fellowship programs were reviewed, and gender representation at each leadership position and academic rank (Division and Fellowship Director and Full, Associate, and Assistant Professor) was recorded. Univariate comparisons were performed using Chi-square tests, with significance at p < 0.05. Among 49 ABOG-accredited reproductive endocrinology programs, 263 faculty were identified, 129 (49.0%) male and 134 (51.0%) female. Division directors were 69.3% male and 30.7% female (p = 0.006). Similarly, fellowship directors were 65.3% male and 34.6% female (p = 0.03). Full professors (n = 101) were more frequently male (70.3% vs. 29.7%, p < 0.001). There was no difference in gender among associate professors (n = 60, 51.7% male vs. 48.3% female, p = 0.79), while significantly more assistant professors were female than male (n = 102, 73.6% vs. 26.4%, p < 0.001). While a majority of residents in obstetrics and gynecology and half of reproductive endocrinology academic faculty are female, women are still underrepresented among leadership positions and full professors in academic reproductive endocrinology programs with fellowship programs.",Journal of assisted reproduction and genetics,2020-Aug,"['Selter JH', 'Spurlin EE', 'Brady PC']","Selter JH, Spurlin EE, Brady PC",3,10.1007/s10815-020-01866-8,"['Academies and Institutes', 'Endocrinology', 'Fellowships and Scholarships', 'Female', 'Gender Equity', 'Gynecology', 'Humans', 'Leadership', 'Male', 'Pregnancy', 'Reproductive Techniques, Assisted', 'Sex Factors', 'United States']",True,1435,endocrinology,2026-04-22
33118411,33118411,Electronic Glycemic Management System and Endocrinology Service Improve Value in Cardiac Surgery.,"Postoperative glycemic control improves cardiac surgery outcomes but insulin protocols are limited by complexity and inflexibility. We sought to evaluate the effect of implementing an electronic glycemic management system (eGMS) in conjunction with a cardiac surgery endocrinology consult service on glycemic control and outcomes after cardiac surgery. All patients with a calculated preoperative risk of mortality who underwent cardiac surgery before and after implementation of an eGMS and an endocrinology consult service were identified. Glycemic control and surgical outcomes were compared using univariate analysis, and multivariate regression was used to model the risk-adjusted effects of the interventions on glycemic control, surgical outcomes, and resource utilization. The health care-related value added by the interventions was calculated by dividing risk-adjusted outcomes by total hospital costs. A total of 2612 patients were identified, with 1263 patients in the preimplementation cohort and 1349 in the postimplementation cohort. Multivariate regression demonstrated fewer postoperative hyperglycemic events (odds ratio [OR] 0.8, 95% CI, 0.65-0.99) after protocol implementation without an increase in hypoglycemic events (OR 0.96, 95% CI, 0.71-1.3). Average day-weighted mean glucose decreased from 144 to 138 mg/dL (<i>P</i> < .001). The improved glycemic control correlated with a risk-adjusted decrease in composite morbidity or mortality (OR 0.61, 95% CI, 0.47-0.79). Although hospital costs increased after implementation, the protocol increased health care-related value by 38%. Implementation of a protocol consisting of an eGMS paired with a cardiac surgery-specific endocrinology consult service was associated with improved glycemic control and reduced morbidity. Despite higher costs health care-related value increased as a result of eGMS implementation.",The American surgeon,2021-Apr,"['Chancellor WZ', 'Mehaffey JH', 'Hawkins RB', 'Charles EJ', 'Tribble C', 'Yarboro LT', 'Ailawadi G', 'Kirby JL']","Chancellor WZ, Mehaffey JH, Hawkins RB, Charles EJ, Tribble C, Yarboro LT, Ailawadi G, Kirby JL",8,10.1177/0003134820950685,"['Aged', 'Cardiac Surgical Procedures', 'Electrical Equipment and Supplies', 'Endocrinology', 'Female', 'Glycemic Control', 'Humans', 'Hyperglycemia', 'Hypoglycemia', 'Male', 'Middle Aged', 'Postoperative Care', 'Postoperative Complications', 'Referral and Consultation', 'Retrospective Studies', 'Treatment Outcome']",True,1886,endocrinology,2026-04-22
32508313,32508313,ENDOCRINOLOGY IN THE TIME OF COVID-19: Remodelling diabetes services and emerging innovation.,"The COVID-19 pandemic is a major international emergency leading to unprecedented medical, economic and societal challenges. Countries around the globe are facing challenges with diabetes care and are similarly adapting care delivery, with local cultural nuances. People with diabetes suffer disproportionately from acute COVID-19 with higher rates of serious complications and death. In-patient services need specialist support to appropriately manage glycaemia in people with known and undiagnosed diabetes presenting with COVID-19. Due to the restrictions imposed by the pandemic, people with diabetes may suffer longer-term harm caused by inadequate clinical support and less frequent monitoring of their condition and diabetes-related complications. Outpatient management need to be reorganised to maintain remote advice and support services, focusing on proactive care for the highest risk, and using telehealth and digital services for consultations, self-management and remote monitoring, where appropriate. Stratification of patients for face-to-face or remote follow-up should be based on a balanced risk assessment. Public health and national organisations have generally responded rapidly with guidance on care management, but the pandemic has created a tension around prioritisation of communicable vs non-communicable disease. Resulting challenges in clinical decision-making are compounded by a reduced clinical workforce. For many years, increasing diabetes mellitus incidence has been mirrored by rising preventable morbidity and mortality due to complications, yet innovation in service delivery has been slow. While the current focus is on limiting the terrible harm caused by the pandemic, it is possible that a positive lasting legacy of COVID-19 might include accelerated innovation in chronic disease management.",European journal of endocrinology,2020-Aug,"['Wake DJ', 'Gibb FW', 'Kar P', 'Kennon B', 'Klonoff DC', 'Rayman G', 'Rutter MK', 'Sainsbury C', 'Semple RK']","Wake DJ, Gibb FW, Kar P, Kennon B, Klonoff DC, Rayman G, Rutter MK, Sainsbury C, Semple RK",9,10.1530/EJE-20-0377,"['Betacoronavirus', 'COVID-19', 'Coronavirus Infections', 'Diabetes Mellitus', 'Endocrinology', 'Humans', 'Pandemics', 'Pneumonia, Viral', 'SARS-CoV-2', 'Telemedicine', 'Therapies, Investigational', 'United Kingdom']",True,1835,endocrinology,2026-04-22
38299892,38299892,Endocrinology's early historians (1889-1914) and the forgotten prehistory of testosterone.,"An often-retold historical outline of endocrinology was established over a century ago. An exhaustive history of sexual physiology remains forthcoming, however. To explore and contextualize the remarkable medical-historical and medical-anthropologic frenzy triggered by Brown-Séquard's 1889 self-injections with testicular juice, which ultimately settled down into an early history of endocrinology. Pertinent primary sources were selected from a broader study, primarily between 1889 and 1914, as well as selected older texts identified and unidentified by these sources. Endocrinology's early historians in a short space of time moved from the history of testicular opotherapy to that of glandular typology and physiology and to increasingly encompassing medical-historical accounts of internal secretion as an epochal idea. Early historians nominated ""precursors"" to Brown-Séquard but underestimated physiologic continuities-specifically, early modern protoendocrinologic notions concerning semen as a ""recrement,"" notions still recited by Brown-Séquard and early Brown-Séquardists as well their detractors. Brown-Séquard himself worked through this old (recremental) concept of semen between 1889 and 1892 but was later identified with it, by among others Ancel and Bouin. Western sexual physiology is a medical palimpsest, the undertexts of which remain to be studied in detail.",Sexual medicine reviews,2024-Mar-26,['Janssen DF'],Janssen DF,1,10.1093/sxmrev/qeae001,"['Humans', 'Testosterone', 'Endocrinology', 'Semen']",True,1383,endocrinology,2026-04-22
39733943,39733943,Physician Assistants in Clinical Endocrinology: Characteristics and Demographics.,"Physician assistants (PAs) are employed in endocrinology, but little is known about their roles and activities. The study aimed to assess PAs' employment characteristics in endocrinology compared to those in all other specialties. This descriptive observational study used the 2022 National Commission on Certification of PAs dataset. The study includes 117 748 board-certified PAs who indicated a clinical specialty in 2022. The characteristics of PAs in endocrinology were examined using descriptive statistics, including counts and percentages for categorical variables; means (with standard deviations), and medians (with interquartile ranges) for continuous variables. Bivariate analyses (ꭙ<sup>2</sup> and Mann-Whitney U tests) were used to determine statistical differences between PAs practicing in endocrinology versus PAs in all other specialties. This study found that as of 2022, 685 PAs reported practicing in endocrinology. PAs in endocrinology, compared to PAs in all other specialties (all P < .001), were more likely to identify as female (82.0% vs 69.6%), work in an office-based private practice (61.3% vs 37.0%), and participate in telemedicine (70.8% vs 40.1%). Conversely, PAs in endocrinology were less likely to work in a secondary position, saw slightly fewer patients weekly, and earned $10,000 less yearly than their PA colleagues in all other specialties. Examining the PA endocrinology workforce is essential due to the shortage of endocrinologists and the increased prevalence of diabetes as the U.S. population ages. Understanding where PAs in endocrinology are employed and their attributes could assist efforts in specialty modeling to address supply and demand projections.",Endocrine practice : official journal of the American College of Endocrinology and the American Association of Clinical Endocrinologists,2025-Apr,"['McKenna RE', 'Hooker RS', 'Bruza-Augatis M', 'Puckett K', 'Kozikowski A']","McKenna RE, Hooker RS, Bruza-Augatis M, Puckett K, Kozikowski A",5,10.1016/j.eprac.2024.12.016,"['Adult', 'Female', 'Humans', 'Male', 'Middle Aged', 'Employment', 'Endocrinology', 'Physician Assistants', 'United States', 'Datasets as Topic']",True,1707,endocrinology,2026-04-22
34016437,34016437,Perceptions and lessons from web-based interviews for the reproductive endocrinology and infertility fellowship application cycle.,"To evaluate the experience and perceptions of reproductive endocrinology and infertility fellowship applicants and program directors (PDs) regarding the current and future use of web-based interviews (WBIs). Cross-sectional study. Nationwide cohort. Reproductive endocrinology and infertility fellowship applicants and PDs participating in the 2020 application cycle. Anonymous survey sent to applicants and PDs. Descriptive study evaluating the experience and satisfaction of applicants and PDs with WBIs. Forty-six percent of applicants and eligible PDs responded to our survey. Most applicants and PDs responded that WBIs were adequate for conveying a sense of a program's strengths, faculty, diversity, clinical training, and research opportunities, but less than half responded that WBIs were adequate in providing a sense of the program's clinical site and facilities. After WBIs, both applicants (73%) and PDs (86%) were able to rank with confidence. The cost of WBIs was significantly lower for both applicants (median: $100) and programs (median: $100) than the costs previously reported for in-person interviews. The applicants interviewed at more programs than they would have if the interviews were on-site, and Zoom was the highest rated platform used. Most applicants and PDs responded that WBIs were an adequate substitute, and that they should continue after the coronavirus disease 2019 pandemic. Furthermore, most of the PDs were planning to continue to use WBIs in some capacity. Both applicants and PDs had favorable experiences with and perceptions of WBIs, and most endorse the continued use of this interview modality. The findings of this study can help guide and optimize future WBI practices.",Fertility and sterility,2021-Sep,"['Hariton E', 'Raker CA', 'Frishman GN', 'Feinberg EC']","Hariton E, Raker CA, Frishman GN, Feinberg EC",4,10.1016/j.fertnstert.2021.04.020,"['Adult', 'COVID-19', 'Cross-Sectional Studies', 'Endocrinology', 'Fellowships and Scholarships', 'Female', 'Humans', 'Infertility', 'Internet', 'Internship and Residency', 'Interpersonal Relations', 'Interviews as Topic', 'Job Application', 'Male', 'Middle Aged', 'Pandemics', 'Perception', 'Personal Satisfaction', 'Physicians', 'Reproductive Medicine', 'SARS-CoV-2', 'Students, Medical', 'Surveys and Questionnaires']",True,1718,endocrinology,2026-04-22
35487770,35487770,"Comprehensive guidance for human embryology, andrology, and endocrinology laboratories: management and operations: a committee opinion.","This document is a comprehensive guidance for human embryology, andrology, and endocrinology laboratories. Universal guidance applicable to all laboratories includes requirements and recommendations for accreditation and staffing in the United States, and specific guidance is included for each laboratory specialty.",Fertility and sterility,2022-Jun,[],,0,10.1016/j.fertnstert.2022.02.016,"['Andrology', 'Embryology', 'Endocrinology', 'Humans', 'Laboratories', 'United States', 'Workforce']",True,316,endocrinology,2026-04-22
38253221,38253221,Consensus statement by the French Society of Endocrinology (SFE) and French Society of Pediatric Endocrinology & Diabetology (SFEDP) for the diagnosis of Cushing's syndrome: Genetics of Cushing's syndrome.,"Cushing's syndrome is due to overproduction of cortisol, leading to abnormal and prolonged exposure to cortisol. The most common etiology is Cushing disease, while adrenal causes are rarer. Knowledge of the genetics of Cushing's syndrome, and particularly the adrenal causes, has improved considerably over the last 10 years, thanks in particular to technical advances in high-throughput sequencing. The present study, by a group of experts from the French Society of Endocrinology and the French Society of Pediatric Endocrinology and Diabetology, reviewed the literature on germline genetic alterations leading to a predisposition to develop Cushing's syndrome. The review led to a consensus statement on genetic screening for Cushing disease and adrenal Cushing's syndrome.",Annales d'endocrinologie,2024-Jul,"['Martinerie L', 'Bouligand J', 'North MO', 'Bertherat J', 'Assié G', 'Espiard S']","Martinerie L, Bouligand J, North MO, Bertherat J, Assié G, Espiard S",6,10.1016/j.ando.2024.01.005,"['Child', 'Humans', 'Cushing Syndrome', 'Endocrinology', 'France', 'Genetic Predisposition to Disease', 'Genetic Testing', 'Germ-Line Mutation', 'Societies, Medical']",True,776,endocrinology,2026-04-22
