paper_id,pmid,title,abstract,journal,publication_date,authors,authors_str,num_authors,doi,mesh_terms,has_abstract,abstract_length,specialty,collection_date
35895957,35895957,Training for the future.,"The aim of this study was to review the evolving field of Reproductive Endocrinology and Infertility (REI) and describe the current and future challenges REI fellowship programmes in the United States are facing. The field of REI continues to rapidly evolve largely due to the tremendous advances within the assisted reproductive technologies (ARTs). Alongside this evolution, there is a lessening emphasis on graduates being proficient in all aspects of REI. Ongoing revisions to the REI fellowship structure reflect these changes in technology and contemporary practice patterns. REI is a rapidly evolving field and fellowship training is continually adapting to meet the changing landscape of our field.",Current opinion in obstetrics & gynecology,2022-Aug-01,"['Ghidei L', 'Frishman GN']","Ghidei L, Frishman GN",2,10.1097/GCO.0000000000000800,"['Endocrinology', 'Fellowships and Scholarships', 'Humans', 'Infertility', 'Internship and Residency', 'Reproductive Techniques, Assisted', 'United States']",True,706,endocrinology,2026-04-22
38280804,38280804,"Gastrointestinal hormones: History, biology, and measurement.","This chapter attempts to provide an all-round picture of a dynamic and major branch of modern endocrinology, i.e. the gastrointestinal endocrinology. The advances during the last half century in our understanding of the dimensions and diversity of gut hormone biology - inside as well as outside the digestive tract - are astounding. Among major milestones are the dual brain-gut relationship, i.e. the comprehensive expression of gastrointestinal hormones as potent transmitters in central and peripheral neurons; the hormonal signaling from the enteroendocrine cells to the brain and other extraintestinal targets; the role of gut hormones as growth and fertility factors; and the new era of gut hormone-derived drugs. Accordingly, gastrointestinal hormones have pathogenetic roles in major metabolic disorders (diabetes mellitus and obesity); in tumor development (common cancers, sarcomas, and neuroendocrine tumors); and in cerebral diseases (anxiety, panic attacks, and probably eating disorders). Such clinical aspects require accurate pathogenetic and diagnostic measurements of gastrointestinal hormones - an obvious responsibility for clinical chemistry/biochemistry. In order to obtain a necessary insight into today's gastrointestinal endocrinology, the chapter will first describe the advances in gastrointestinal endocrinology in a historical context. The history provides a background for the subsequent description of the present biology of gastrointestinal hormones, and its biomedical consequences - not least for clinical chemistry/biochemistry with its specific responsibility for selection of appropriate assays and reliable measurements.",Advances in clinical chemistry,2024,"['Rehfeld JF', 'Goetze JP']","Rehfeld JF, Goetze JP",2,10.1016/bs.acc.2023.11.004,"['Humans', 'Gastrointestinal Hormones', 'Gastrointestinal Tract', 'Endocrinology', 'Signal Transduction', 'Biology']",True,1659,endocrinology,2026-04-22
39067980,39067980,Endocrinology in Primary Care.,,Primary care,2024-Sep,"['Malone M', 'Jain V']","Malone M, Jain V",2,10.1016/j.pop.2024.06.001,"['Humans', 'Primary Health Care', 'Endocrinology', 'Endocrine System Diseases']",False,0,endocrinology,2026-04-22
37031556,37031556,Evolutionary behavioral endocrinology: Introduction to the special issue.,,Hormones and behavior,2023-Jun,"['Vitousek MN', 'Dantzer B', 'Fuxjager MJ', 'Schlinger BA']","Vitousek MN, Dantzer B, Fuxjager MJ, Schlinger BA",4,10.1016/j.yhbeh.2023.105356,"['Endocrinology', 'Biological Evolution']",False,0,endocrinology,2026-04-22
33348380,33348380,"Diabetes, Sports and Exercise.",,"Experimental and clinical endocrinology & diabetes : official journal, German Society of Endocrinology [and] German Diabetes Association",2021-Aug,"['Esefeld K', 'Kress S', 'Behrens M', 'Zimmer P', 'Stumvoll M', 'Thurm U', 'Gehr B', 'Brinkmann C', 'Halle M']","Esefeld K, Kress S, Behrens M, Zimmer P, Stumvoll M, Thurm U, Gehr B, Brinkmann C, Halle M",9,10.1055/a-1284-6097,"['Adult', 'Diabetes Mellitus', 'Dietary Carbohydrates', 'Drug Dosage Calculations', 'Endocrinology', 'Exercise', 'Exercise Therapy', 'Germany', 'Glucose Intolerance', 'Humans', 'Insulin', 'Life Style', 'Sports']",False,0,endocrinology,2026-04-22
38972718,38972718,Causal inference and machine learning in endocrine epidemiology.,"With the rapid development of computer science, there is an increasing demand for the use of causal inference methods and machine learning in the research of endocrine disorders and their long-term health outcomes. However, studies on the effective and appropriate applications of these approaches in real-world data and clinical settings are still limited. This review will illustrate the use of causal inference and machine learning in epidemiological research within the field of endocrinology and metabolism. It will examine each concept of causal inference and machine learning through application examples of endocrine disorders. Subsequently, the paper will discuss the integration of machine learning within the causal inference framework, including (i) the estimation of treatment effects or the causal relationship between exposure and outcomes, and (ii) the evaluation of heterogeneity in such treatment effects (or exposure-outcome causal relationship) based on individuals' characteristics. Accurately assessing causal relationships and their heterogeneity across different individuals is crucial not only for determining effective interventions, but also for the appropriate allocation of medical resources and reducing healthcare disparities. By illustrating some application examples in endocrinology, this review aims to enhance readers' understanding and application of causal inference and machine learning in future epidemiological studies focusing on endocrine disorders.",Endocrine journal,2024-Oct-01,['Inoue K'],Inoue K,1,10.1507/endocrj.EJ24-0193,"['Humans', 'Machine Learning', 'Endocrine System Diseases', 'Endocrinology', 'Causality']",True,1492,endocrinology,2026-04-22
39569757,39569757,"The International Symposium on Avian Endocrinology, 1977-2024: Past, present and future.","The First International Symposium on Avian Endocrinology (ISAE) was held 47 years ago at the Grand Hotel in Kolkata (Calcutta), India. Professor Asok Ghosh organized and convened the symposium, and Professor Donald S. Farner was President. The 1977 ISAE was convened at a time when neuroendocrine cascades were emerging as major pathways by which environmental events are perceived and transduced resulting in endocrine secretions that then orchestrate life history stages. Methods to measure hormone concentrations in blood and other tissues were relatively recent allowing the advance of laboratory and field investigations to explore ecological bases of endocrine control systems. The rise of evolutionary endocrinology and theory in ecological contexts followed-topics that are flourishing today. Studies on poultry continue to play central roles at ISAE meetings. In recent decades, the incorporation of genomics, transcriptomics, proteomics, epigenetics and other technologies provide us with an unprecedented array of tools to explore endocrinological processes at mechanistic levels we could never have dreamed of in 1977. The future looks to be an era of major advances in neuroendocrinology. What technologies will arise and transform our knowledge further? Artificial intelligence (AI) is emerging as a tool in avian endocrinology in at least research on endocrine disrupting chemicals. Will AI facilitate new advances and research directions across the field? The future of basic research has never been brighter than it is now. As in the past, ISAEs in the next decades will integrate new discoveries across environmental and applied biology. New challenges will doubtless appear.",Journal of neuroendocrinology,2025-Jun,['Wingfield JC'],Wingfield JC,1,10.1111/jne.13470,"['Animals', 'Birds', 'Congresses as Topic', 'Endocrinology', 'History, 20th Century', 'History, 21st Century', 'Neuroendocrinology']",True,1693,endocrinology,2026-04-22
34801996,34801996,Potentialities of Gene Therapy in Pediatric Endocrinology.,"Gene therapy has become an appealing therapeutic option in many pediatric fields, including endocrinology. Unlike traditional drugs based on molecules that require repeated and frequent burdensome administrations, a single genetic therapeutic intervention may allow durable and curative clinical benefits. Although this highly innovative technology holds a great promise for the treatment of monogenic diseases, its clinical applications in the field of endocrinology have been so far challenging. In this review, we will discuss various ex vivo and in vivo approaches and potential applications of gene addition and gene editing approaches for treating hyperfunctional and hypofunctional endocrine diseases due to intrinsic defects or autoimmune origin. We will focus on the recent advances in gene therapy approaches aimed at treating type 1 diabetes and monogenic forms of endocrinopathies such as growth hormone deficiency, congenital adrenal hyperplasia, diabetes insipidus, IPEX, as well as their trends and future directions.",Hormone research in paediatrics,2023,"['Frontino G', 'Stancampiano MR', 'Aiuti A']","Frontino G, Stancampiano MR, Aiuti A",3,10.1159/000520965,"['Humans', 'Child', 'Endocrinology', 'Endocrine System Diseases', 'Endocrine System', 'Diabetes Mellitus, Type 1', 'Genetic Therapy']",True,1032,endocrinology,2026-04-22
34109724,34109724,ISPAD roving reporters 2020.,,Pediatric diabetes,2021-Aug,"['Marks BE', 'Harnois-Leblanc S', 'Ng SM', 'Perez-Garcia EM', 'Ahmad PO', 'Adhami S', 'Mandilou SVM', 'Yauch LM', 'Ehtisham S']","Marks BE, Harnois-Leblanc S, Ng SM, Perez-Garcia EM, Ahmad PO, Adhami S, Mandilou SVM, Yauch LM, Ehtisham S",9,10.1111/pedi.13233,"['Adolescent', 'Blood Glucose Self-Monitoring', 'COVID-19', 'Child', 'Child, Preschool', 'Congresses as Topic', 'Cross-Cultural Comparison', 'Cultural Diversity', 'Developing Countries', 'Diabetes Complications', 'Diabetes Mellitus', 'Diet', 'Dyslipidemias', 'Endocrinology', 'Female', 'History, 21st Century', 'Humans', 'Male', 'Obesity', 'Societies, Medical', 'Young Adult']",False,0,endocrinology,2026-04-22
38577976,38577976,Standardized Reproductive Endocrinology and Infertility Consultation for Pediatric and Adolescent Oncology Patients.,"<b><i>Purpose:</i></b> To investigate the role of formal reproductive endocrinology and infertility (REI) consultation in fertility preservation counseling in a pediatric/adolescent oncology patient population. <b><i>Methods:</i></b> Retrospective chart review was performed at an academic adult hospital from 2021 to 2022. Pre- and postpubertal patients admitted to the pediatric/adolescent oncology service with cancer diagnoses and imminent gonadotoxic chemotherapy plans were included. Baseline characteristics were collected, including patient age, sex, race, language, insurance, and cancer diagnosis. Primary outcomes were formal REI consultation and fertility preservation election. <b><i>Results:</i></b> Nineteen of 58 eligible patients received a formal REI consultation. Patients were more likely to elect fertility preservation if they received a consult. Females were more likely to receive a consult than males and more likely to elect fertility preservation. Patients of age ≥16 years were more likely to receive consultation than younger patients. However, all patients of age <16 years who received a consult elected fertility preservation. There was no difference in consultation based on race, language, or insurance. Thirteen of 19 patients who received an REI consultation elected fertility preservation. Ten of 11 female elections were ovarian suppression, an unproven method of fertility preservation. The two male elections were semen cryopreservation. <b><i>Conclusion:</i></b> Underutilization of formal REI consults and a relative lack of proven fertility preservation elections may shed light on a need for increased fertility preservation awareness among young oncology patients and the providers who care for them. A streamlined process that automates formal REI consultation for all eligible patients may maximize the potential for comprehensive counseling and improve patient participation in fertility preservation.",Journal of adolescent and young adult oncology,2024-Aug,"['Hartup LA', 'Go VA', 'Robinson RD']","Hartup LA, Go VA, Robinson RD",3,10.1089/jayao.2024.0009,"['Humans', 'Male', 'Female', 'Adolescent', 'Retrospective Studies', 'Neoplasms', 'Child', 'Infertility', 'Fertility Preservation', 'Referral and Consultation', 'Endocrinology', 'Adult', 'Young Adult']",True,1949,endocrinology,2026-04-22
34507934,34507934,"Interplay between endocrinology, metabolism and COVID-19 infection.","There are more than 170 million confirmed cases of COVID-19 worldwide, yet its effects on the endocrine system remain under-reported due to lack of awareness by the public, primary care givers and specialists. This is a narrative review using up-to-date literature discussing the consequences that infection with SARS-CoV-2 can have on diabetes and the endocrine glands including the adrenals, thyroid and pituitary, as well as hyponatremia and hypogonadism. Endocrinologists, internists and primary care physicians need to be aware of the involvement of the endocrine organs when dealing with people recovering from COVID-19 and actively manage any complications to reduce mortality and improve the quality of life of those affected.","Clinical medicine (London, England)",2021-Sep,"['Mung SM', 'Jude EB']","Mung SM, Jude EB",2,10.7861/clinmed.2021-0200,"['COVID-19', 'Diabetes Mellitus', 'Endocrinology', 'Humans', 'Quality of Life', 'SARS-CoV-2']",True,734,endocrinology,2026-04-22
34924184,34924184,"Teaming: learning, competing, and innovating in the world of reproductive medicine.","Healthcare teams must be deliberately cultivated to reach their full potential. Shifting focus from individual performance to a team's collective competence allows for targeted and evidence-based interventions that support teamwork and improve patient outcomes. We reviewed essential concepts drawn from team science and explored the practical applications of teaming. Reproductive endocrinology and infertility healthcare providers play a pivotal role by teaching, modeling, and fostering teaming attitudes and behaviors. Through teaming, we can maximize our teams' ability to learn, innovate, compete with other teams, and thrive in today's healthcare environment.",Fertility and sterility,2022-Jan,"['Minehart RD', 'Su HK', 'Petrozza JC']","Minehart RD, Su HK, Petrozza JC",3,10.1016/j.fertnstert.2021.11.030,"['Clinical Competence', 'Endocrinology', 'Female', 'Health Personnel', 'Humans', 'Inventions', 'Learning', 'Male', 'Patient Care Team', 'Pregnancy', 'Reproductive Medicine', 'Therapies, Investigational']",True,666,endocrinology,2026-04-22
37884738,37884738,Health equity in endocrinology.,,Nature reviews. Endocrinology,2024-Mar,"['Backholer K', 'Ebekozien O', 'Hofman K', 'Miranda JJ', 'Seidu S']","Backholer K, Ebekozien O, Hofman K, Miranda JJ, Seidu S",5,10.1038/s41574-023-00912-6,"['Humans', 'Health Equity', 'Endocrinology']",False,0,endocrinology,2026-04-22
39009925,39009925,Inositols and female reproduction disorders: a consensus statement from the working group of the Club of the Italian Society of Endocrinology (SIE)-Women's Endocrinology.,"To provide the latest scientific knowledge on the efficacy of inositols for improving reproductive disorders in women with and without polycystic ovary syndrome (PCOS) and to reach a consensus on their potential use through a Delphi-like process. A panel of 17 endocrinologists and 1 gynecologist discussed 4 key domains: menses irregularity and anovulation, fertility, pregnancy outcomes, and neonatal outcomes. A total of eight consensus statements were drafted. Myo-inositol (Myo) supplementation can be used to improve menses irregularities and anovulation in PCOS. Myo supplementation can be used in subfertile women with or without PCOS to reduce the dose of r-FSH for ovarian stimulation during IVF, but it should not be used to increase the clinical pregnancy rate or live birth rate. Myo supplementation can be used in the primary prevention of gestational diabetes mellitus (GDM), but should not be used to improve pregnancy outcomes in women with GDM. Myo can be preconceptionally added to folic acid in women with a previous neural tube defects (NTD)-complicated pregnancy to reduce the risk of NTDs in newborns. Myo can be used during pregnancy to reduce the risk of macrosomia and neonatal hypoglycemia in mothers at risk of GDM. This consensus statement provides recommendations aimed at guiding healthcare practitioners in the use of inositols for the treatment or prevention of female reproductive disorders. More evidence-based data are needed to definitively establish the usefulness of Myo, the appropriate dosage, and to support the use of D-chiro-inositol (DCI) or a definitive Myo/DCI ratio.",Journal of endocrinological investigation,2024-Sep,"['Moretti C', 'Bonomi M', 'Dionese P', 'Federici S', 'Fulghesu AM', 'Giannelli J', 'Giordano R', 'Guccione L', 'Maseroli E', 'Moghetti P', 'Mioni R', 'Pivonello R', 'Sabbadin C', 'Scaroni C', 'Tonacchera M', 'Verde N', 'Vignozzi L', 'Gambineri A']","Moretti C, Bonomi M, Dionese P, Federici S, Fulghesu AM, Giannelli J, Giordano R, Guccione L, Maseroli E, Moghetti P, Mioni R, Pivonello R, Sabbadin C, Scaroni C, Tonacchera M, Verde N, Vignozzi L, Gambineri A",18,10.1007/s40618-024-02363-w,"['Humans', 'Female', 'Inositol', 'Pregnancy', 'Polycystic Ovary Syndrome', 'Endocrinology', 'Pregnancy Outcome', 'Infertility, Female', 'Italy', 'Dietary Supplements', 'Diabetes, Gestational', 'Pregnancy Complications', 'Societies, Medical']",True,1614,endocrinology,2026-04-22
33336347,33336347,Diabetic Retinopathy and Maculopathy.,,"Experimental and clinical endocrinology & diabetes : official journal, German Society of Endocrinology [and] German Diabetes Association",2021-Aug,"['Hammes HP', 'Lemmen KD', 'Bertram B']","Hammes HP, Lemmen KD, Bertram B",3,10.1055/a-1284-6223,"['Diabetes Mellitus, Type 1', 'Diabetes Mellitus, Type 2', 'Diabetic Retinopathy', 'Diagnostic Techniques, Endocrine', 'Endocrinology', 'Germany', 'Humans', 'Macular Degeneration', 'Risk Factors']",False,0,endocrinology,2026-04-22
37008910,37008910,Editorial: Community series in SIRT family in endocrinology.,,Frontiers in endocrinology,2023,"['Hou Y', 'Cheng Y', 'Tian Y', 'Yang Y']","Hou Y, Cheng Y, Tian Y, Yang Y",4,10.3389/fendo.2023.1163226,"['Endocrinology', 'Sirtuins']",False,0,endocrinology,2026-04-22
32771255,32771255,Reproducible research practices and transparency in reproductive endocrinology and infertility articles.,"To analyse the published literature in reproductive endocrinology and infertility (REI) to examine the transparency and the use of reproducible research practices of the scientific literature and to identify possible avenues for improvement. Meta-epidemiologic study. We examined the first 20 consecutive full-text original articles presenting primary data from five REI-specific journals for 2013 and for 2018, and eligible REI articles published in 2013-2018 in five high-impact general journals. Eligible articles were required to be full-text original articles, presenting primary data. Not applicable. Not applicable. Not applicable. Each article was assessed for study type, trial registration, protocol and raw data availability, funding and conflict of interest declarations, inclusion in subsequent systematic reviews and/or meta-analyses, sample size, and whether the work claimed to be novel or replication. Sample sizes and citation counts also were obtained. A total of 222 articles were deemed eligible; 98 from REI journals published in 2013, 90 from REI journals published in 2018, and 34 from high-impact journals. There were 37 studies registered, 15 contained a protocol, and two stated actively that they were willing to share data. Most studies provided a statement about funding and conflicts of interest. Two articles explicitly described themselves as replications. All randomized controlled trial published in REI journals were registered prospectively; many meta-analyses were not registered. High-impact journal articles had a greater median sample size and more citations and were more likely to be registered, to have a protocol, and to claim novelty explicitly when compared with REI 2013 and 2018 articles. Research in REI can be improved in prospective registration, routine availability of protocols, wider sharing of raw data whenever feasible, and more emphasis on replication.",Fertility and sterility,2020-Dec,"['Kemper JM', 'Rolnik DL', 'Mol BWJ', 'Ioannidis JPA']","Kemper JM, Rolnik DL, Mol BWJ, Ioannidis JPA",4,10.1016/j.fertnstert.2020.05.020,"['Animals', 'Bibliometrics', 'Biomedical Research', 'Endocrinology', 'Female', 'Humans', 'Infertility', 'Journal Impact Factor', 'Meta-Analysis as Topic', 'Periodicals as Topic', 'Pregnancy', 'Reproductive Medicine', 'Research Design', 'Systematic Reviews as Topic']",True,1912,endocrinology,2026-04-22
38427159,38427159,Endocrine Surgery at the NIH: History and Contributions.,,Annals of surgical oncology,2024-Jun,['Fraker DL'],Fraker DL,1,10.1245/s10434-024-15084-4,"['Humans', 'United States', 'National Institutes of Health (U.S.)', 'History, 20th Century', 'History, 21st Century', 'Endocrine Surgical Procedures', 'Endocrinology']",False,0,endocrinology,2026-04-22
39359412,39359412,Editorial: Interdisciplinary research in diabetology.,,Frontiers in endocrinology,2024,"['Tavasoli N', 'Larijani B']","Tavasoli N, Larijani B",2,10.3389/fendo.2024.1490025,"['Humans', 'Interdisciplinary Research', 'Diabetes Mellitus', 'Endocrinology']",False,0,endocrinology,2026-04-22
39829215,39829215,Novel radiopharmaceuticals in endocrinology: a comprehensive review.,"Endocrinology is the study of hormones and the endocrine glands that are responsible for maintaining homeostasis in the human body. Recently, there has been a surge of interest in the development of novel radiopharmaceuticals for diagnostic and therapeutic purposes in endocrinology. This comprehensive review explores the latest advances in novel radiopharmaceuticals with applications in the diagnosis and treatment of different endocrine disorders, including thyroid, adrenal, and pituitary disorders, as well as neuroendocrine tumours. The article discusses innovative approaches that leverage the decay characteristics of radioisotopes to enhance the accuracy of diagnostic imaging and the therapeutic capability of targeted interventions. It covers the fundamental principles underlying radiopharmaceutical design, synthesis, and imaging modalities, as well as the mechanisms that drive their efficacy in endocrine applications. Furthermore, the clinical implications of these novel radiopharmaceuticals are explored, along with their role in early detection, precise localisation, and personalised treatment strategies. Case studies and clinical trials are cited to highlight the practical utility and potential transformative impact of these advancements in the management of endocrine diseases. This review also notes current challenges, ongoing research and development, and future directions in the field. By providing a comprehensive overview of the evolving landscape of radiopharmaceuticals in endocrinology, this article aims to contribute to the collective knowledge base and foster a deeper understanding of the potential benefits and implications of these innovative technologies for both clinicians and researchers in the field of endocrine health.",Endokrynologia Polska,2024,"['Pocięgiel M', 'Saniewski T', 'Wrzosek K', 'Opyd P', 'Franek E', 'Lis M']","Pocięgiel M, Saniewski T, Wrzosek K, Opyd P, Franek E, Lis M",6,10.5603/ep.99756,"['Humans', 'Radiopharmaceuticals', 'Endocrine System Diseases', 'Endocrinology']",True,1767,endocrinology,2026-04-22
