paper_id,pmid,title,abstract,journal,publication_date,authors,authors_str,num_authors,doi,mesh_terms,has_abstract,abstract_length,specialty,collection_date
37649088,37649088,"Breast stiffness, a risk factor for cancer and the role of radiology for diagnosis.","Over the last five decades, breast density has been associated with increased risk of developing breast cancer. Mammographically dense breasts are considered those belonging to the heterogeneously dense breasts, and extremely dense breasts subgroups according to the American College of Radiology's Breast Imaging Reporting and Data System (BI-RADS). There is a statistically significant correlation between the increased mammographic density and the presence of more glandular tissue alone. However, the strength of this correlation is weak. Although the mechanisms driving breast density-related tumor initiation and progression are still unknown, there is evidence suggesting that certain molecular pathways participating in epithelial-stromal interactions may play a pivotal role in the deposition of fibrillar collagen, increased matrix stiffness, and cell migration that favor breast density and carcinogenesis. This article describes these molecular mechanisms as potential ""landscapers"" for breast density-related cancer. We also introduce the term ""Breast Compactness"" to reflect collagen density of breast tissue on chest CT scan and the use of breast stiffness measurements as imaging biomarkers for breast cancer screening and risk stratification.",Journal of translational medicine,2023-Aug-30,"['Tarchi SM', 'Pernia Marin M', 'Hossain MM', 'Salvatore M']","Tarchi SM, Pernia Marin M, Hossain MM, Salvatore M",4,10.1186/s12967-023-04457-0,"['Humans', 'Female', 'Radiology', 'Breast Neoplasms', 'Breast', 'Tomography, X-Ray Computed', 'Risk Factors']",True,1259,radiology,2026-04-22
37167090,37167090,Becoming a Successful Radiologist: Toolbox for Supplementing Radiology Education in the Digital Age.,,"Radiographics : a review publication of the Radiological Society of North America, Inc",2023-Jun,"['Sailer A', 'Vijan A', 'Silva AM', 'Solomon N']","Sailer A, Vijan A, Silva AM, Solomon N",4,10.1148/rg.220201,"['Humans', 'Radiology', 'Radiography', 'Radiologists']",False,0,radiology,2026-04-22
34625201,34625201,Marie Curie: How to break the glass ceiling in science and in radiology.,"Marie Curie was born in Warsaw in1867. She graduated first in her class in her undergraduate programs in physics and mathematics at Sorbonne University, and she was one of the first women to earn a PhD. She was the first woman to win a Nobel prize (in physics, together with her husband, Pierre Curie), and she was also the first person to win a second Nobel prize in another category (chemistry). Her life is an example of dedication to science based on altruism, personal growth, and tenacity. Being the first woman to break through so many barriers in a totally male-dominated science makes her an emblematic figure in the fight for equal opportunities and human rights. This article reviews her most important contributions to science in general and to diagnostic radiology in particular through her participation in the French military's radiological plan during the First World War.",Radiologia,2021,"['Sánchez-Oro R', 'Torres Nuez J', 'Fatahi Bandpey ML', 'Martínez-Sanz G']","Sánchez-Oro R, Torres Nuez J, Fatahi Bandpey ML, Martínez-Sanz G",4,10.1016/j.rxeng.2021.04.005,"['Female', 'Humans', 'Male', 'Mathematics', 'Nobel Prize', 'Physics', 'Radiography', 'Radiology']",True,888,radiology,2026-04-22
33004148,33004148,The History and Birth of CIRSE: An Exercise in Unification.,,Journal of vascular and interventional radiology : JVIR,2020-Oct,"['Zollikofer CL', 'Allison DJ', 'Erikson U']","Zollikofer CL, Allison DJ, Erikson U",3,10.1016/j.jvir.2020.03.017,"['Congresses as Topic', 'Cooperative Behavior', 'History, 20th Century', 'History, 21st Century', 'Humans', 'International Cooperation', 'Radiography, Interventional', 'Radiology, Interventional', 'Societies, Medical']",False,0,radiology,2026-04-22
37217432,37217432,Teaching Artificial Intelligence Literacy: A Challenge in the Education of Radiology Residents.,,Academic radiology,2023-Jul,['Mello-Thoms C'],Mello-Thoms C,1,10.1016/j.acra.2023.04.035,"['Humans', 'Artificial Intelligence', 'Literacy', 'Radiography', 'Radiology', 'Educational Status', 'Teaching']",False,0,radiology,2026-04-22
38691945,38691945,The Emergence of robotics in liver interventional radiology: Navigating New Frontiers.,,European journal of radiology,2024-Jun,"['Bodard S', 'Guinebert S', 'Tacher V', 'Cornelis FH']","Bodard S, Guinebert S, Tacher V, Cornelis FH",4,10.1016/j.ejrad.2024.111482,"['Humans', 'Radiology, Interventional', 'Radiography, Interventional', 'Liver Neoplasms', 'Robotic Surgical Procedures', 'Surgery, Computer-Assisted', 'Robotics']",False,0,radiology,2026-04-22
39627625,39627625,Complications in interventional radiology: early detection and effective intervention strategies.,"This narrative review provides a comprehensive overview of complications in interventional radiology (IR), focusing on their aetiology, recognition, and management. As IR procedures continue to evolve and expand, understanding potential adverse events is crucial for improving patient safety and outcomes. The review will summarise various common complications associated with IR-based procedures, including their presentation, aetiology, and management. By consolidating current knowledge on these issues, the review offers valuable insights into minimising risks and enhancing procedural success. This synthesis will aid practitioners' knowledge and ultimately try and ensure safer IR practices and aftercare of patients.",Irish journal of medical science,2025-Feb,"['Temperley HC', 'Hylands A', ""O'Sullivan NJ"", 'Mac Curtain BM', 'Temperley TS', 'Waters C', 'McEniff N', 'Brennan I', 'Sheahan K']","Temperley HC, Hylands A, O'Sullivan NJ, Mac Curtain BM, Temperley TS, Waters C, McEniff N, Brennan I, Sheahan K",9,10.1007/s11845-024-03845-9,"['Humans', 'Radiology, Interventional', 'Early Diagnosis', 'Radiography, Interventional']",True,723,radiology,2026-04-22
35545087,35545087,Radiology Review.,,The journal of knee surgery,2022-Apr,['Wissman RD'],Wissman RD,1,10.1055/s-0041-1740631,"['Humans', 'Radiography', 'Radiology']",False,0,radiology,2026-04-22
39086143,39086143,Quality Improvement in Interventional Radiology: A Critical Look at Modern Bleeding Risk Guideline Implementation.,,Canadian Association of Radiologists journal = Journal l'Association canadienne des radiologistes,2024-Nov,"['Warren BE', 'Jaberi A', 'Mafeld SC']","Warren BE, Jaberi A, Mafeld SC",3,10.1177/08465371241268405,"['Humans', 'Quality Improvement', 'Radiology, Interventional', 'Hemorrhage', 'Practice Guidelines as Topic', 'Radiography, Interventional', 'Guideline Adherence']",False,0,radiology,2026-04-22
37406772,37406772,A Review of Materials and Medications with Religious or Dietary Significance in the Interventional Radiology Suite.,A holistic approach to patient-centered care should include cultural and religious considerations. Certain cultural groups have beliefs that may restrict the use of particular animal-derived products and chemicals. A working knowledge of ingredients commonly used in the interventional suite with religious and cultural connotations may be helpful. This review article highlights medications and medical devices with cultural or religiously sensitive ingredients used in interventional radiology departments and provides a framework for addressing this common scenario.,Journal of vascular and interventional radiology : JVIR,2023-Oct,"['Wilson R', 'Hu Z', ""O'Brien C"", 'Meer E', 'Agarwal A', 'Murray T']","Wilson R, Hu Z, O'Brien C, Meer E, Agarwal A, Murray T",6,10.1016/j.jvir.2023.06.035,"['Humans', 'Radiography, Interventional', 'Religion and Medicine', 'Health Knowledge, Attitudes, Practice', 'Radiology, Interventional', 'Equipment and Supplies', 'Holistic Health', 'Culturally Competent Care']",True,569,radiology,2026-04-22
35852427,35852427,Thank You from the <i>Radiology</i> In Training Editors to Their Mentors.,,Radiology,2022-Nov,"['Kim E', 'Deng F', 'Trofimova A']","Kim E, Deng F, Trofimova A",3,10.1148/radiol.221386,"['Humans', 'Mentors', 'Radiology', 'Radiography']",False,0,radiology,2026-04-22
35972359,35972359,"Bias, Noise, and Consensus Interpretation in Radiology.",,Radiology,2022-Dec,"['Baird GL', 'Bernstein MH', 'Atalay MK']","Baird GL, Bernstein MH, Atalay MK",3,10.1148/radiol.220055,"['Humans', 'Consensus', 'Radiology', 'Radiography']",False,0,radiology,2026-04-22
32037301,32037301,A new look at quality assurance in oral and maxillofacial radiology.,,"Oral surgery, oral medicine, oral pathology and oral radiology",2020-Apr,['Geist JR'],Geist JR,1,10.1016/j.oooo.2019.12.011,"['Radiography', 'Radiology']",False,0,radiology,2026-04-22
36897551,36897551,Writing medical papers using large-scale language models: a perspective from the Japanese Journal of Radiology.,,Japanese journal of radiology,2023-May,"['Nakaura T', 'Naganawa S']","Nakaura T, Naganawa S",2,10.1007/s11604-023-01408-z,"['Humans', 'Language', 'Radiography', 'Radiology', 'Writing', 'Japan', 'Medical Writing']",False,0,radiology,2026-04-22
37073904,37073904,Editorial Comment: Analyzing Causes and Generating Strategies to Mitigate Diagnostic Errors in Radiology Practice.,,AJR. American journal of roentgenology,2023-Sep,['Tuna IS'],Tuna IS,1,10.2214/AJR.23.29460,"['Humans', 'Case-Control Studies', 'Radiology', 'Radiography', 'Diagnostic Errors']",False,0,radiology,2026-04-22
36722765,36722765,Editorial Comment: Reducing Health Disparities in Radiology-Action Is Needed.,,AJR. American journal of roentgenology,2023-Jul,['Snyder EJ'],Snyder EJ,1,10.2214/AJR.23.29045,"['Humans', 'Health Equity', 'Radiology', 'Radiography']",False,0,radiology,2026-04-22
39025608,39025608,Interventional radiologists and OBLs: An excellent match.,"While office-based laboratories (OBLs) have been increasing in popularity, only a small proportion of the current interventional radiology (IR) workforce works in an OBL. With the relative lack of an IR presence in OBLs compared to other endovascular specialists, combined with the growth of the OBL space, the presence of IR within OBLs will likely increase in the coming years. This article addresses the value interventional radiologists (IRs) can bring to the OBL, with primary impacts being the ability to impact a larger proportion of the population than is traditionally cared for in most hospital settings, the ability to positively influence multidisciplinary care teams and the financial leverage inherent in procedural diversification not readily afforded by other specialists working in the OBL space. IR-specific pitfalls in the OBL space are also addressed, including difficulties in obtaining patient referrals, investor relationships, and group practice arrangements. Despite potential challenges, IRs have a lot to offer within the OBL space, and conversely, the OBL space provides a mechanism for IRs to increase their reach and improve career longevity.",Techniques in vascular and interventional radiology,2024-Mar,['Devulapalli KK'],Devulapalli KK,1,10.1016/j.tvir.2024.100952,"['Humans', 'Career Choice', 'Job Description', 'Patient Care Team', 'Radiography, Interventional', 'Radiologists', 'Radiology, Interventional', 'Referral and Consultation']",True,1172,radiology,2026-04-22
37436035,37436035,The Future of Interventional Radiology: Counterpoint-Interventional and Diagnostic Radiology Will Be Better Together.,,AJR. American journal of roentgenology,2023-Dec,"['Talenfeld AD', 'Min RJ']","Talenfeld AD, Min RJ",2,10.2214/AJR.23.29683,"['Humans', 'Radiology, Interventional', 'Radiography', 'Forecasting']",False,0,radiology,2026-04-22
35766533,35766533,Editorial Comment: Exciting Future of Artificial Intelligence for Radiology May Lie in the Routine.,,AJR. American journal of roentgenology,2022-Nov,['Donnelly EF'],Donnelly EF,1,10.2214/AJR.22.28174,"['Humans', 'Artificial Intelligence', 'Prospective Studies', 'Radiology', 'Radiography', 'Tomography, X-Ray Computed']",False,0,radiology,2026-04-22
39025614,39025614,Sole operator: Owning and Operating an Independent Office-Based Lab.,"Owning and operating an Office-Based Lab (OBL) creates a unique career, combining the privilege of practicing Interventional Radiology (IR) with the creativity and excitement of running a complex business. No business is more complicated than the American Healthcare system, with a combination of necessary operational systems, government and commercial reimbursement, local and national regulations, an ever-changing landscape, and various patient populations; the business is always shifting. No field is as complex and exciting as Interventional Radiology, with advanced clinical and technical expertise, device development, rocedural ingenuity, and the ability to solve complex medical problems with elegant solutions. A sole owner and operator in an OBL has full autotomy, and thus full responsibility for the medical and business aspects of the practice.",Techniques in vascular and interventional radiology,2024-Mar,['Costantino MM'],Costantino MM,1,10.1016/j.tvir.2024.100951,"['Humans', 'Private Practice', 'Radiography, Interventional', 'Radiologists', 'Radiology, Interventional']",True,860,radiology,2026-04-22
34642114,34642114,Online Video Education in Radiology - More Than a Fad.,,Academic radiology,2022-May,['Weinberg BD'],Weinberg BD,1,10.1016/j.acra.2021.09.014,"['Education, Distance', 'Humans', 'Radiography', 'Radiology']",False,0,radiology,2026-04-22
38269712,38269712,A FHIR Native Radiology Informatics Platform.,FHIR is a new standard that is rapidly being adopted in healthcare. We describe and implement a Radiology informatics platform (RIS) that is FHIR native and incorporates the ability to execute AI algorithms to aid with the interpretation of scans. Our design utilises the FHIR workflow pattern as an application programming interface with functionality provided by independent micro services thus granting flexibility and expandability.,Studies in health technology and informatics,2024-Jan-25,"['Raniga P', 'Min H', 'Leroux H']","Raniga P, Min H, Leroux H",3,10.3233/SHTI231260,"['Radiography', 'Radiology', 'Algorithms', 'Health Facilities', 'Informatics']",True,436,radiology,2026-04-22
35320463,35320463,Women in radiology: the SIRM believes in equal opportunity.,,La Radiologia medica,2022-Mar,"['Giovagnoni A', 'Gandolfo N', 'Miele V']","Giovagnoni A, Gandolfo N, Miele V",3,10.1007/s11547-022-01474-9,"['Female', 'Humans', 'Radiography', 'Radiology']",False,0,radiology,2026-04-22
34016606,34016606,Artificial intelligence for thoracic radiology: from research tool to clinical practice.,,The European respiratory journal,2021-May,"['Calandriello L', 'Walsh SLF']","Calandriello L, Walsh SLF",2,10.1183/13993003.00625-2021,"['Artificial Intelligence', 'Humans', 'Radiography', 'Radiography, Thoracic', 'Radiology']",False,0,radiology,2026-04-22
35380493,35380493,Top 10 Tips for Writing Your Scientific Paper: The <i>Radiology</i> Scientific Style Guide.,,Radiology,2022-Jul,"['Atzen SL', 'Bluemke DA']","Atzen SL, Bluemke DA",2,10.1148/radiol.229005,"['Humans', 'Radiography', 'Radiology', 'Writing']",False,0,radiology,2026-04-22
35124980,35124980,Restoring Timely Access to Medical Imaging in Canada: A Prescription for Renewed Radiology Investments.,,Canadian Association of Radiologists journal = Journal l'Association canadienne des radiologistes,2022-Aug,"['Soulez G', 'Kielar A', 'Hurrell C', 'Schmidt H']","Soulez G, Kielar A, Hurrell C, Schmidt H",4,10.1177/08465371221075617,"['Canada', 'Diagnostic Imaging', 'Humans', 'Investments', 'Prescriptions', 'Radiography', 'Radiology']",False,0,radiology,2026-04-22
37945871,37945871,Sydney Blackman (1898-1971): a pioneer in dental radiology and radiography.,"Sydney Blackman, was a consultant radiologist at the Royal Dental Hospital of London between 1931 and 1967. He contributed much to the advance of dento-maxillofacial radiology. His development of the 'rotograph' as the first commercially available dental panoramic machine established dental radiology on a level with medical radiology. Sydney was a major contributor to the establishment of the British Society of Dental and Maxillofacial Radiology.",British dental journal,2023-Nov,['Gelbier S'],Gelbier S,1,10.1038/s41415-023-6442-0,"['Male', 'Humans', 'Radiography', 'Radiology', 'London', 'Radiography, Dental', 'Radiography, Panoramic']",True,450,radiology,2026-04-22
35302392,35302392,Listening to You to Make <i>Radiology: Imaging Cancer</i> Even Better.,,Radiology. Imaging cancer,2022-Mar,['Luker GD'],Luker GD,1,10.1148/rycan.229005,"['Auditory Perception', 'Diagnostic Imaging', 'Humans', 'Neoplasms', 'Radiography', 'Radiology']",False,0,radiology,2026-04-22
33484282,33484282,"Visual abstract for Abdominal Radiology: what it is, why we need it and how to make it.",,Abdominal radiology (New York),2021-Jun,"['Brook OR', 'Vernuccio F', 'Nicola R', 'Cannella R', 'Altinmakas E']","Brook OR, Vernuccio F, Nicola R, Cannella R, Altinmakas E",5,10.1007/s00261-020-02941-5,"['Humans', 'Radiography, Abdominal', 'Radiology']",False,0,radiology,2026-04-22
34629263,34629263,The American Board of Radiology's Alternate Pathway for Diagnostic Radiology: What the Programs and the Applicants Need to Know.,"The American Board of Radiology (ABR) developed the international medical graduate alternate pathway to give foreign trained radiologists an alternate route to independent radiology practice without having to undergo radiology residency in the United States. After 4 years of fellowship/faculty experience in the same training institution, the foreign trained radiologist becomes eligible to sit for the radiology board examinations conducted by the ABR. As this pathway is not offered at every radiology training program, many training institutions are unfamiliar with the fundamentals of this pathway. At the same time, both the training institutions and the applying foreign-trained physicians face a plethora of confusing choices on the state and federal level. In this paper, we review the main factors which both the international medical graduate radiologists and training programs must consider before embarking on the diagnostic radiology ABR Alternate Pathway, namely, eligibility, visa options, state medical licensure requirements, their costs and implications for future employment opportunities.",Academic radiology,2022-Mar,"['Huda F', 'Rozenshtein A', 'Bedi H']","Huda F, Rozenshtein A, Bedi H",3,10.1016/j.acra.2021.09.017,"['Education, Medical, Graduate', 'Fellowships and Scholarships', 'Humans', 'Internship and Residency', 'Radiography', 'Radiologists', 'Radiology', 'United States']",True,1109,radiology,2026-04-22
35138135,35138135,Why Physician Virtue Is Critical to the Survival of Radiology.,"Physician virtue, a set of disposition and personality traits based on the caring virtues, is vital to the continued eminence of radiology as a medical profession in the dawn of the age of artificial intelligence. This Viewpoint outlines what physician virtue is, why it can be challenging to access in radiology, and what radiologists can do to try to nurture it within themselves.",AJR. American journal of roentgenology,2022-Jul,['Herr KD'],Herr KD,1,10.2214/AJR.21.27253,"['Artificial Intelligence', 'Humans', 'Physicians', 'Radiography', 'Radiologists', 'Radiology', 'Virtues']",True,382,radiology,2026-04-22
36154303,36154303,Canadian Association of Radiologists/Canadian Association for Interventional Radiology/Canadian Society of Thoracic Radiology Guidelines on Thoracic Interventions.,"Thoracic interventions are frequently performed by radiologists, but guidelines on appropriateness criteria and technical considerations to ensure patient safety regarding such interventions is lacking. These guidelines, developed by the Canadian Association of Radiologists, Canadian Association for Interventional Radiology and Canadian Society of Thoracic Radiology focus on the interventions commonly performed by thoracic radiologists. They provide evidence-based recommendations and expert consensus informed best practices for patient preparation; biopsies of the lung, mediastinum, pleura and chest wall; thoracentesis; pre-operative lung nodule localization; and potential complications and their management.",Canadian Association of Radiologists journal = Journal l'Association canadienne des radiologistes,2023-May,"['Nguyen ET', 'Bayanati H', 'Hurrell C', 'Aitken M', 'Cheung EM', 'Gupta A', 'Harris S', 'Sedlic T', 'Taylor JL', 'Gahide G', 'Dennie C']","Nguyen ET, Bayanati H, Hurrell C, Aitken M, Cheung EM, Gupta A, Harris S, Sedlic T, Taylor JL, Gahide G, Dennie C",11,10.1177/08465371221122807,"['Humans', 'Radiology, Interventional', 'Canada', 'Radiography', 'Radiography, Thoracic', 'Radiologists']",True,717,radiology,2026-04-22
38340436,38340436,The role of moonlighting in radiology residency.,,Clinical imaging,2024-Apr,"['Musa A', 'Hall H', 'Johnson SC', 'Alchammas J', 'Badawy M', 'Harb A']","Musa A, Hall H, Johnson SC, Alchammas J, Badawy M, Harb A",6,10.1016/j.clinimag.2024.110083,"['Humans', 'United States', 'Internship and Residency', 'Radiology', 'Education, Medical, Graduate', 'Radiography', 'Radiology, Interventional']",False,0,radiology,2026-04-22
35995513,35995513,Follow-up of Incidental Radiology Findings: Is the Cart Ahead of the Horse?,,Annals of emergency medicine,2022-Sep,"['Pacella CB', 'Yealy DM']","Pacella CB, Yealy DM",2,10.1016/j.annemergmed.2022.07.007,"['Animals', 'Follow-Up Studies', 'Horses', 'Radiography', 'Radiology']",False,0,radiology,2026-04-22
33223480,33223480,Act 112 and Radiology.,,Journal of the American College of Radiology : JACR,2021-Jan,"['Naringrekar H', 'Lee RK', 'Reilly T']","Naringrekar H, Lee RK, Reilly T",3,10.1016/j.jacr.2020.09.061,"['Radiography', 'Radiology', 'United States']",False,0,radiology,2026-04-22
38193843,38193843,Jellyfish Sign for Visceral Pleural Invasion in Lung Cancer: Reviving the Lost Art of Radiology.,,Radiology,2024-Jan,['Nishino M'],Nishino M,1,10.1148/radiol.233171,"['Humans', 'Lung Neoplasms', 'Radiography', 'Radiology']",False,0,radiology,2026-04-22
37791734,37791734,Editorial Comment: Artificial Intelligence for Detection of Endotracheal Tube Malposition-Augmented Rather Than Autonomous Radiology Interpretation.,,AJR. American journal of roentgenology,2024-Jan,['Little BP'],Little BP,1,10.2214/AJR.23.30297,"['Humans', 'Artificial Intelligence', 'Radiography', 'Radiology', 'Intubation, Intratracheal', 'Patients']",False,0,radiology,2026-04-22
37086589,37086589,Radiographers' perception of patient safety culture in radiology.,"Radiographers play a central role in patient safety because of their knowledge of and responsibilities in relation to the imaging process. To maintain safe care, the workplace must create a safety culture that enables sustainable safety work. This study aims to describe radiographers' perceptions of the patient safety culture in radiology units in Sweden. The Swedish Hospital Survey of Patients' Safety Culture (S-HSOPSC) was used to gather descriptive data from 171 Swedish registered radiographers working in five radiology clinics distributed across 15 units. Fifty-one questionnaire items and one open-ended question were analysed, comprising perceptions of the overall safety grade, the frequency of number of reported risks and events, and 14 composites regarding patient safety dimensions. The radiographers' concerns surrounding the patient safety culture in their workplaces related to weaknesses regarding the safety dimensions ""Staffing"", ""Frequency of error reporting"", ""Organizational learning - continuous improvement"" and ""Executive management support for patient safety"". They perceived ""Teamwork within the unit"" to be a strength. Despite some weaknesses in the patient safety culture, the radiographers perceived that the overall patient safety level was good, in part because of their ability to spot risks in time. The executive management, however, needed to improve their feedback on safety measures; and another reason for some weaknesses in the patient safety culture could be staffing issues such as lack of time for meetings for continuous improvement. Managers and leaders have a great responsibility to establish a patient safety culture through support and good leadership. An understanding of what creates a safety culture is important to prevent patient safety incidents.","Radiography (London, England : 1995)",2023-May,"['Wallin A', 'Bazzi M', 'Ringdal M', 'Ahlberg K', 'Lundén M']","Wallin A, Bazzi M, Ringdal M, Ahlberg K, Lundén M",5,10.1016/j.radi.2023.04.005,"['Humans', 'Patient Safety', 'Safety Management', 'Radiology', 'Radiography', 'Perception']",True,1805,radiology,2026-04-22
