paper_id,pmid,title,abstract,journal,publication_date,authors,authors_str,num_authors,doi,mesh_terms,has_abstract,abstract_length,specialty,collection_date
34352804,34352804,Artificial Intelligence in Chest Radiography Reporting Accuracy: Added Clinical Value in the Emergency Unit Setting Without 24/7 Radiology Coverage.,"Chest radiographs (CXRs) are commonly performed in emergency units (EUs), but the interpretation requires radiology experience. We developed an artificial intelligence (AI) system (precommercial) that aims to mimic board-certified radiologists' (BCRs') performance and can therefore support non-radiology residents (NRRs) in clinical settings lacking 24/7 radiology coverage. We validated by quantifying the clinical value of our AI system for radiology residents (RRs) and EU-experienced NRRs in a clinically representative EU setting. A total of 563 EU CXRs were retrospectively assessed by 3 BCRs, 3 RRs, and 3 EU-experienced NRRs. Suspected pathologies (pleural effusion, pneumothorax, consolidations suspicious for pneumonia, lung lesions) were reported on a 5-step confidence scale (sum of 20,268 reported pathology suspicions [563 images × 9 readers × 4 pathologies]) separately by every involved reader. Board-certified radiologists' confidence scores were converted into 4 binary reference standards (RFSs) of different sensitivities. The RRs' and NRRs' performances were statistically compared with our AI system (trained on nonpublic data from different clinical sites) based on receiver operating characteristics (ROCs) and operating point metrics approximated to the maximum sum of sensitivity and specificity (Youden statistics). The NRRs lose diagnostic accuracy to RRs with increasingly sensitive BCRs' RFSs for all considered pathologies. Based on our external validation data set, the AI system/NRRs' consensus mimicked the most sensitive BCRs' RFSs with areas under ROC of 0.940/0.837 (pneumothorax), 0.953/0.823 (pleural effusion), and 0.883/0.747 (lung lesions), which were comparable to experienced RRs and significantly overcomes EU-experienced NRRs' diagnostic performance. For consolidation detection, the AI system performed on the NRRs' consensus level (and overcomes each individual NRR) with an area under ROC of 0.847 referenced to the BCRs' most sensitive RFS. Our AI system matched RRs' performance, meanwhile significantly outperformed NRRs' diagnostic accuracy for most of considered CXR pathologies (pneumothorax, pleural effusion, and lung lesions) and therefore might serve as clinical decision support for NRRs.",Investigative radiology,2022-Feb-01,"['Rudolph J', 'Huemmer C', 'Ghesu FC', 'Mansoor A', 'Preuhs A', 'Fieselmann A', 'Fink N', 'Dinkel J', 'Koliogiannis V', 'Schwarze V', 'Goller S', 'Fischer M', 'Jörgens M', 'Ben Khaled N', 'Vishwanath RS', 'Balachandran A', 'Ingrisch M', 'Ricke J', 'Sabel BO', 'Rueckel J']","Rudolph J, Huemmer C, Ghesu FC, Mansoor A, Preuhs A, Fieselmann A, Fink N, Dinkel J, Koliogiannis V, Schwarze V, Goller S, Fischer M, Jörgens M, Ben Khaled N, Vishwanath RS, Balachandran A, Ingrisch M, Ricke J, Sabel BO, Rueckel J",20,10.1097/RLI.0000000000000813,"['Artificial Intelligence', 'Emergency Service, Hospital', 'Humans', 'Lung Diseases', 'Pleural Effusion', 'Pneumothorax', 'Radiography', 'Radiography, Thoracic', 'Radiology', 'Retrospective Studies']",True,2249,radiology,2026-04-22
35180443,35180443,More From Moore's Law: The Journey to Toy Story and Implications for Radiology.,,Journal of the American College of Radiology : JACR,2022-Apr,"['Smith AR', 'Lugo-Fagundo E', 'Fishman EK', 'Rowe SP', 'Chu LC']","Smith AR, Lugo-Fagundo E, Fishman EK, Rowe SP, Chu LC",5,10.1016/j.jacr.2022.01.009,"['Radiography', 'Radiology']",False,0,radiology,2026-04-22
34708669,34708669,What's the near future of the radiology.,,Urologia,2021-Nov,"['Di Paola V', 'Manfredi R']","Di Paola V, Manfredi R",2,10.1177/03915603211055284,"['Humans', 'Radiography', 'Radiology']",False,0,radiology,2026-04-22
34491136,34491136,An Artificially Intelligent Solution for a Real Problem in Musculoskeletal Radiology: Bone Tumors.,,Radiology,2021-Nov,['Carrino JA'],Carrino JA,1,10.1148/radiol.2021211560,"['Bone Neoplasms', 'Humans', 'Radiography', 'Radiology']",False,0,radiology,2026-04-22
34561165,34561165,Artificial Intelligence in Radiology Education: A Longitudinal Approach.,,Academic radiology,2022-May,"['Gowda V', 'Jordan SG', 'Awan OA']","Gowda V, Jordan SG, Awan OA",3,10.1016/j.acra.2021.08.022,"['Artificial Intelligence', 'Humans', 'Radiography', 'Radiology']",False,0,radiology,2026-04-22
30803753,30803753,Improving Hiring Practices in Radiology: Lessons from Google.,,Current problems in diagnostic radiology,2022,"['Shah HU', 'Kalia V', 'Fessell DP', 'Bhargava P']","Shah HU, Kalia V, Fessell DP, Bhargava P",4,10.1067/j.cpradiol.2019.02.007,"['Humans', 'Personnel Selection', 'Radiography', 'Radiology', 'Search Engine', 'United States']",False,0,radiology,2026-04-22
34569300,34569300,Artificial Intelligence in Radiology: A Canadian Environmental Scan.,,Canadian Association of Radiologists journal = Journal l'Association canadienne des radiologistes,2022-May,"['Li D', 'Yi PH']","Li D, Yi PH",2,10.1177/08465371211038940,"['Artificial Intelligence', 'Canada', 'Humans', 'Radiography', 'Radiology']",False,0,radiology,2026-04-22
33676912,33676912,Trustworthiness of Artificial Intelligence Models in Radiology and the Role of Explainability.,,Journal of the American College of Radiology : JACR,2021-Aug,"['Kitamura FC', 'Marques O']","Kitamura FC, Marques O",2,10.1016/j.jacr.2021.02.008,"['Artificial Intelligence', 'Humans', 'Radiography', 'Radiology']",False,0,radiology,2026-04-22
35031151,35031151,"Moving Towards Equity, Wellness, and Environmental Sustainability: Arguments for Virtual Radiology Residency Recruitment and Strategies for Application Control.",,Academic radiology,2022-Jul,"['Nguyen JK', 'Moran SK', 'Yee JM', 'Grimm LJ', 'Heitkamp DE', 'Chapman T']","Nguyen JK, Moran SK, Yee JM, Grimm LJ, Heitkamp DE, Chapman T",6,10.1016/j.acra.2021.12.014,"['Humans', 'Internship and Residency', 'Radiography', 'Radiology', 'SARS-CoV-2']",False,0,radiology,2026-04-22
31385010,31385010,MR defecography technique: recommendations of the society of abdominal radiology's disease-focused panel on pelvic floor imaging.,"To develop recommendations for magnetic resonance (MR) defecography technique based on consensus of expert radiologists on the disease-focused panel of the Society of Abdominal Radiology (SAR). An extensive questionnaire was sent to a group of 20 experts from the disease-focused panel of the SAR. The questionnaire encompassed details of technique and MRI protocol used for evaluating pelvic floor disorders. 75% agreement on questionnaire responses was defined as consensus. The expert panel reached consensus for 70% of the items and provided the basis of these recommendations for MR defecography technique. There was unanimous agreement that patients should receive coaching and explanation of commands used during MR defecography, the rectum should be distended with contrast agent, and that sagittal T2-weighted images should include the entire pelvis within the field of view. The panel also agreed unanimously that IV contrast should not be used for MR defecography. Additional areas of consensus ranged in agreement from 75 to 92%. We provide a set of consensus recommendations for MR defecography technique based on a survey of expert radiologists in the SAR pelvic floor dysfunction disease-focused panel. These recommendations can be used to develop a standardized imaging protocol.",Abdominal radiology (New York),2021-Apr,"['Lalwani N', 'Khatri G', 'El Sayed RF', 'Ram R', 'Jambhekar K', 'Chernyak V', 'Kamath A', 'Lewis S', 'Flusberg M', 'Scholz F', 'Arif-Tiwari H', 'Palmer SL', 'Lockhart ME', 'Fielding JR']","Lalwani N, Khatri G, El Sayed RF, Ram R, Jambhekar K, Chernyak V, Kamath A, Lewis S, Flusberg M, Scholz F, Arif-Tiwari H, Palmer SL, Lockhart ME, Fielding JR",14,10.1007/s00261-019-02160-7,"['Defecography', 'Humans', 'Magnetic Resonance Imaging', 'Pelvic Floor', 'Pelvic Floor Disorders', 'Radiology']",True,1295,radiology,2026-04-22
31563521,31563521,Building Trust in Radiology Practice.,,Journal of the American College of Radiology : JACR,2020-Feb,"['Slanetz PJ', 'Perry H', 'Kudla A', 'Soto JA']","Slanetz PJ, Perry H, Kudla A, Soto JA",4,10.1016/j.jacr.2019.09.002,"['Radiography', 'Radiology', 'Trust']",False,0,radiology,2026-04-22
39104261,39104261,Reflections on the American Academy of Oral and Maxillofacial Radiology and the American Dental Association Guidelines for Patient Shielding During Dentomaxillofacial Radiography.,,Thyroid : official journal of the American Thyroid Association,2024-Oct,"['Schneider AB', 'Lubin JH', 'Kaplan MM', 'Mihailescu DV']","Schneider AB, Lubin JH, Kaplan MM, Mihailescu DV",4,10.1089/thy.2024.0274,"['Humans', 'Radiation Protection', 'Radiography, Dental', 'United States', 'Practice Guidelines as Topic', 'Societies, Dental', 'Radiology']",False,0,radiology,2026-04-22
36070934,36070934,Transformative radiology: Chest imaging is being re-defined.,,"Respirology (Carlton, Vic.)",2022-Oct,"['Lau KK', 'Troupis JM', 'Parsons D']","Lau KK, Troupis JM, Parsons D",3,10.1111/resp.14358,"['Humans', 'Radiography, Thoracic', 'Radiology', 'Thorax']",False,0,radiology,2026-04-22
39069832,39069832,Society of Interventional Radiology Position Statement on Endovascular Intervention for Trauma.,,Pediatrics,2024-Aug-01,[],,0,10.1542/peds.2024-067606,"['Humans', 'Endovascular Procedures', 'Societies, Medical', 'Wounds and Injuries', 'Radiology, Interventional', 'Child', 'Radiography, Interventional']",False,0,radiology,2026-04-22
37387635,37387635,"Response to 'Integrating clinical judgment, advanced radiology, and molecular diagnosis: the modern ways of pneumonia management'.",,European journal of emergency medicine : official journal of the European Society for Emergency Medicine,2023-Aug-01,['Claessens YE'],Claessens YE,1,10.1097/MEJ.0000000000001040,"['Humans', 'Judgment', 'Radiography', 'Radiology', 'Pneumonia']",False,0,radiology,2026-04-22
36602572,36602572,"The Society of Abdominal Radiology at 10 years: Reflections, status report, and look to the future.","In 2012, the Society of Abdominal Radiology (SAR) was formed by the merger of the Society of Gastrointestinal Radiologists (SGR) and the Society of Uroradiology (SUR). On the occasion of SAR's ten year anniversary, this commentary describes important changes in society structure, the growth and diversity of society membership, new educational and research initiatives, intersociety and international outreach, and plans for the future.",Abdominal radiology (New York),2023-Feb,"['Maturen KE', 'Canon CL', 'Fletcher JG', 'Hara AK', 'Kim DH', 'Kruskal JB', 'Miller FH', 'Remer EM', 'Silverman SG']","Maturen KE, Canon CL, Fletcher JG, Hara AK, Kim DH, Kruskal JB, Miller FH, Remer EM, Silverman SG",9,10.1007/s00261-022-03767-z,"['Humans', 'Radiology', 'Societies, Medical', 'Forecasting', 'Radiography, Abdominal']",True,437,radiology,2026-04-22
34476824,34476824,A cadaveric simulation-teaching model for radiology residents.,,Medical education,2021-Nov,"['Creze M', 'Meyrignac O', 'Guenoun D']","Creze M, Meyrignac O, Guenoun D",3,10.1111/medu.14646,"['Cadaver', 'Humans', 'Internship and Residency', 'Radiography', 'Radiology', 'Teaching']",False,0,radiology,2026-04-22
38309976,38309976,AI generated literature reviews in musculoskeletal radiology: Comment.,,The surgeon : journal of the Royal Colleges of Surgeons of Edinburgh and Ireland,2024-Apr,"['Daungsupawong H', 'Wiwanitkit V']","Daungsupawong H, Wiwanitkit V",2,10.1016/j.surge.2024.01.002,"['Humans', 'Radiology', 'Radiography']",False,0,radiology,2026-04-22
36921449,36921449,Impact of a structured reporting template on the quality of HRCT radiology reports for interstitial lung disease.,"This QI study compared the completeness of HRCT radiology reports before and after the implementation of a disease-specific structured reporting template for suspected cases of interstitial lung disease (ILD). A pre-post study of radiology reports for HRCT of the thorax at a multicenter health system was performed. Data was collected in 6-month period intervals before (June 2019-November 2019) and after (January 2021-June 2021) the implementation of a disease-specific template. The use of the template was voluntary. The primary outcome measure was the completeness of HRCT reports graded based on the documentation of ten descriptors. The secondary outcome measure assessed which descriptor(s) improved after the intervention. 521 HRCT reports before and 557 HRCT reports after the intervention were reviewed. Of the 557 reports, 118 reports (21%) were created using the structured reporting template. The mean completeness score of the pre-intervention group was 9.20 (SD = 1.08) and the post-intervention group was 9.36 (SD = 1.03) with a difference of -0.155, 95% CI [-0.2822, -0.0285, p < 0.0001]. Within the post-intervention group, the mean completeness score of the unstructured reports was 9.25 (SD = 1.07) and the template reports was 9.93 (SD = 0.25) with a difference of -0.677, 95% CI [-0.7871, -0.5671, p < 0.0001]. After the intervention, the use of two descriptors improved significantly: presence of honeycombing from 78.3% to 85.1% (p < 0.0039) and technique from 90% to 96.6% (p < 0.0001). Shifting to disease-specific structured reporting for HRCT exams of suspected ILD is beneficial, as it improves the completeness of radiology reports. Further research on how to improve the voluntary uptake of a disease-specific template is needed to help increase the acceptance of structured reporting among radiologists.",Clinical imaging,2023-May,"['Ngo HG', 'Nair GB', 'Al-Katib S']","Ngo HG, Nair GB, Al-Katib S",3,10.1016/j.clinimag.2023.03.004,"['Research Report', 'Radiology', 'Lung Diseases, Interstitial', 'Radiography, Thoracic', 'Humans']",True,1837,radiology,2026-04-22
35230921,35230921,"Linda Moy, MD, Named New Editor of <i>Radiology</i>.",,"Radiographics : a review publication of the Radiological Society of North America, Inc",2022,"['Mauro MA', 'Klein JS']","Mauro MA, Klein JS",2,10.1148/rg.229002,"['Humans', 'Radiography', 'Radiology']",False,0,radiology,2026-04-22
34990333,34990333,Invited Commentary: Advancing the Field of Transgender Radiology.,,"Radiographics : a review publication of the Radiological Society of North America, Inc",2022,['Callen AL'],Callen AL,1,10.1148/rg.210188,"['Humans', 'Radiography', 'Radiology', 'Transgender Persons', 'Male', 'Female']",False,0,radiology,2026-04-22
32488979,32488979,Charles Chambers MD MSCAI-A tribute.,,Catheterization and cardiovascular interventions : official journal of the Society for Cardiac Angiography & Interventions,2020-Aug,"['Blankenship JC', 'Applegate RJ', 'Mahmud E']","Blankenship JC, Applegate RJ, Mahmud E",3,10.1002/ccd.29057,"['Cardiology', 'Education, Medical', 'History, 20th Century', 'History, 21st Century', 'Humans', 'Mentors', 'Radiography, Interventional', 'Radiology, Interventional']",False,0,radiology,2026-04-22
34991921,34991921,Value-based radiology in the era of distancing.,,Clinical imaging,2022-Mar,"['Forero PA', 'Campaña JF', 'Triana G']","Forero PA, Campaña JF, Triana G",3,10.1016/j.clinimag.2021.11.027,"['Humans', 'Radiography', 'Radiology']",False,0,radiology,2026-04-22
38844686,38844686,A Proposed Systematic Approach to Safe Inter Hospital Patient Transfer in Interventional Radiology: From Referral to Repatriation.,"There is no reference in the literature regarding the transfer of patients between hospitals for interventional radiology procedures. This paper outlines an approach to assist with the safe assessment, reassessment and repatriation of patients requiring urgent procedures in a different hospital.",Cardiovascular and interventional radiology,2024-Jul,"['Wells D', 'Morgan R', 'Greenway M']","Wells D, Morgan R, Greenway M",3,10.1007/s00270-024-03763-4,"['Humans', 'Patient Transfer', 'Referral and Consultation', 'Radiology, Interventional', 'Patient Safety', 'Radiography, Interventional']",True,296,radiology,2026-04-22
37081230,37081230,"Classic signs in abdominal radiology: the ""Split scar sign"".",,Abdominal radiology (New York),2023-Jul,"['Srisajjakul S', 'Prapaisilp P', 'Bangchokdee S']","Srisajjakul S, Prapaisilp P, Bangchokdee S",3,10.1007/s00261-023-03915-z,"['Humans', 'Cicatrix', 'Radiography, Abdominal', 'Radiology']",False,0,radiology,2026-04-22
33999282,33999282,Implementation of peer learning conferences throughout a multi-site abdominal radiology practice.,"To initiate a peer learning conference for our abdominal radiology division across multiple geographically separated sites and different time zones, and to determine radiologist preference for peer learning versus traditional score-based peer review. We implemented a monthly peer learning videoconference for our abdominal radiology division. Surveys regarding radiologist opinion regarding traditional peer review and the new peer learning conferences were conducted before and after 6 months of conferences. Peer learning conferences were well attended across our multiple sites, with an average of 43 participants per conference. Radiologist opinion regarding peer review was poor, with survey radiologists responding positively to only 1 out of 12 process questions. Opinion regarding peer learning was extremely favorable, with radiologists responding positively to 12 out of the same 12 process questions. After 6 months of peer learning conferences, 87.9% of surveyed radiologists wished to continue them in some fashion, and no one preferred to return to score-based peer review alone. We successfully implemented a peer learning conference for our abdominal radiology division spread out over multiple geographic sites. Our radiologists strongly preferred peer learning conferences over our traditional peer review system for quality control.",Abdominal radiology (New York),2021-Dec,"['Bowman AW', 'Tan N', 'Adamo DA', 'Chen F', 'Venkatesh SK', 'Baumgarten DA']","Bowman AW, Tan N, Adamo DA, Chen F, Venkatesh SK, Baumgarten DA",6,10.1007/s00261-021-03114-8,"['Humans', 'Peer Review', 'Radiography, Abdominal', 'Radiologists', 'Radiology', 'Surveys and Questionnaires']",True,1352,radiology,2026-04-22
35133193,35133193,All Specialties in Radiology Must Address the Climate Crisis.,,Radiology,2022-May,"['Gross JS', 'Thiel CL']","Gross JS, Thiel CL",2,10.1148/radiol.211856,"['Humans', 'Radiography', 'Radiology']",False,0,radiology,2026-04-22
36402534,36402534,Learning radiology: Connecting with the past.,,Radiologia,2022,['Navarro-Ballester A'],Navarro-Ballester A,1,10.1016/j.rxeng.2022.10.003,"['Radiography', 'Radiology']",False,0,radiology,2026-04-22
31839446,31839446,Society of Interventional Radiology Standards Division 2019 Document Review.,,Journal of vascular and interventional radiology : JVIR,2020-Feb,"['Tam AL', 'Heran MKS', 'Sangha BS', 'Rafiei P', 'Ramalingam V', 'Censullo ML', 'Aryafar H', 'Iqbal S']","Tam AL, Heran MKS, Sangha BS, Rafiei P, Ramalingam V, Censullo ML, Aryafar H, Iqbal S",8,10.1016/j.jvir.2019.10.007,"['Consensus', 'Humans', 'Radiography, Interventional', 'Radiology, Interventional']",False,0,radiology,2026-04-22
33249402,33249402,Dr. Marilyn Goske: Innovator in pediatric radiation safety and education: One in a series highlighting women recipients of the ACR Gold Medal.,"Committed to teaching, Dr. Goske developed an academic niche for herself focusing on educational initiatives. She co-created the widely successful Cleveland Clinic Webbased Curriculum for radiology residents, which reached acclaimed success with 65 modules used by 25,000 registrants in 53 countries and over 400 residency programs. With her natural curiosity, enthusiasm and perseverance, Dr. Goske subsequently had the vision to develop a worldwide coalition that included people from all aspects of radiology to broadcast a simple message, image gently. The influential and longstanding campaign, Image Gently, served to educate radiologists, medical physicists, radiologic technologists and most importantly, parents. Dr. Goske wanted to empower parents and the radiology community to improve pediatric patient safety and work towards decreasing radiation exposure in children. She continued her impactful work by establishing the Quality Improvement Registry in CT Scans in children in 2011 and worked as the pediatric radiology representative on the American College of Radiology's Dose Index Registry in 2013. Focused on compassionate patient care, Dr. Goske's overarching goal was to improve the patient experience throughout the many advancements in radiology. Her excellence in patient care, innovative approaches to education and safety, and collaborative ability to bring out the best in radiology led to her being the 2018 recipient of the ACR Gold Medalist, only the ninth woman ever to do so.",Clinical imaging,2021-Apr,"['Koomson J', 'Arleo EK']","Koomson J, Arleo EK",2,10.1016/j.clinimag.2020.10.030,"['Awards and Prizes', 'Child', 'Curriculum', 'Female', 'Humans', 'Internship and Residency', 'Radiation Exposure', 'Radiology', 'Tomography, X-Ray Computed', 'United States']",True,1507,radiology,2026-04-22
37517769,37517769,ChatGPT in Radiology: Transforming Patient Care With Artificial Intelligence Chatbots.,,Journal of the American College of Radiology : JACR,2023-Oct,"['Ray PP', 'Majumder P']","Ray PP, Majumder P",2,10.1016/j.jacr.2023.06.029,"['Humans', 'Artificial Intelligence', 'Radiography', 'Radiology', 'Patient Care']",False,0,radiology,2026-04-22
35688480,35688480,"Shortages of radiology and oncology staff putting cancer patients at risk, college warns.",,BMJ (Clinical research ed.),2022-Jun-10,['Limb M'],Limb M,1,10.1136/bmj.o1430,"['Humans', 'Medical Oncology', 'Neoplasms', 'Radiography', 'Radiology']",False,0,radiology,2026-04-22
37473852,37473852,The Role of Organized Radiology in Advancing Imaging Artificial Intelligence.,,Journal of the American College of Radiology : JACR,2023-Sep,"['Tilkin M', 'Carey CK']","Tilkin M, Carey CK",2,10.1016/j.jacr.2023.06.020,"['Artificial Intelligence', 'Radiography', 'Radiology', 'Diagnostic Imaging']",False,0,radiology,2026-04-22
36244632,36244632,Adverse Event Classification: Clarification and Validation of the Society of Interventional Radiology Specialty-Specific System.,,Journal of vascular and interventional radiology : JVIR,2023-Jan,"['Baerlocher MO', 'Nikolic B', 'Sze DY']","Baerlocher MO, Nikolic B, Sze DY",3,10.1016/j.jvir.2022.10.011,"['Humans', 'Radiology, Interventional', 'Radiography, Interventional']",False,0,radiology,2026-04-22
36549992,36549992,Fostering Artificial Intelligence Education within Radiology Residencies: A Two-Tiered Approach.,,Academic radiology,2023-Sep,"['Hathaway QA', 'Lakhani DA']","Hathaway QA, Lakhani DA",2,10.1016/j.acra.2022.12.009,"['Humans', 'Artificial Intelligence', 'Internship and Residency', 'Radiology', 'Radiography', 'Educational Status']",False,0,radiology,2026-04-22
37415570,37415570,Exploring radiographers' perceptions and knowledge about patient lead shielding: a cross-sectional study in Greece and Cyprus.,"The present study aimed to explore radiographers' knowledge, clinical practice and perceptions regarding the use of patient lead shielding in Greece and Cyprus. Qualitative data were analyzed using conceptual content analysis and through the classification of findings into themes and categories. A total of 216 valid responses were received. Most respondents reported not being aware of the patient shielding recommendations issued by the American Association of Physicists in Medicine (67%) or the guidance issued by the British Institute of Radiology (69%). Shielding-related training was generally not provided by radiography departments (74%). Most of them (85%) reported that they need specific guidance on lead shielding practices. Also, 82% of the respondents said that lead shielding should continue to be used outside the pelvic area when imaging pregnant patients. Pediatric patients are the most common patient category to which lead shielding was applied. Significant gaps in relevant training have been identified among radiographers in Greece and Cyprus, highlighting the need for new protocols and provision of adequate training on lead shielding practices. Radiography departments should invest in appropriate shielding equipment and adequately train their staff.",Radiation protection dosimetry,2023-Aug-09,"['Stogiannos N', 'Psimitis A', 'Bougias H', 'Georgiadou E', 'Leandrou S', 'Papavasileiou P', 'Polycarpou I', 'Malamateniou C', 'McEntee MF']","Stogiannos N, Psimitis A, Bougias H, Georgiadou E, Leandrou S, Papavasileiou P, Polycarpou I, Malamateniou C, McEntee MF",9,10.1093/rpd/ncad194,"['Humans', 'Child', 'Cross-Sectional Studies', 'Cyprus', 'Greece', 'Radiography', 'Radiology']",True,1280,radiology,2026-04-22
35790311,35790311,Data-Driven Quality and Safety Programs in Radiology.,,Radiologic technology,2022,"['Anaskevich LK', 'Kanal KM', 'Zhang J']","Anaskevich LK, Kanal KM, Zhang J",3,,"['Radiography', 'Radiology']",False,0,radiology,2026-04-22
32208102,32208102,Diagnostic Performance of Deep Learning-augmented Radiology Residents.,,Radiology,2020-May,['Deng F'],Deng F,1,10.1148/radiol.2020200227,"['Deep Learning', 'Emergency Service, Hospital', 'Internship and Residency', 'Radiography', 'Radiology']",False,0,radiology,2026-04-22
